{
  "schemaVersion": "1.0.0",
  "collectionId": "docs-20260730080339265-a7f74ece",
  "frameworkId": "ncom",
  "frameworkCommit": "a350b576bbeae6c6254273037a17d2a8730fb80f",
  "pages": [
    {
      "schemaVersion": "1.0.0",
      "id": "doc-c0c14dd857f855e8",
      "sourceId": "ncom-repository-docs",
      "url": "file:.framework-sources/ncom-a350b57/doc/api/components/complexttable.md",
      "title": "ComplextTable（nc-complexttable）",
      "capturedAt": "2026-07-30T08:03:39.268Z",
      "contentHash": "sha256:5d1fcb6a733e292ae1a42f288a93c25220a9cbfd0279f540a409840cb6d1f01c",
      "sections": [
        {
          "level": 1,
          "title": "ComplextTable（nc-complexttable）",
          "line": 1
        },
        {
          "level": 2,
          "title": "组件名",
          "line": 3
        },
        {
          "level": 2,
          "title": "组件描述",
          "line": 7
        },
        {
          "level": 2,
          "title": "属性（Attributes）",
          "line": 11
        },
        {
          "level": 3,
          "title": "items / sub-items（ComplextTableColumn）配置项",
          "line": 28
        },
        {
          "level": 3,
          "title": "GridLine（grid-line 属性）",
          "line": 43
        },
        {
          "level": 3,
          "title": "Editor（editor 属性）",
          "line": 51
        },
        {
          "level": 3,
          "title": "子表格数据",
          "line": 60
        },
        {
          "level": 2,
          "title": "Public 方法",
          "line": 64
        },
        {
          "level": 3,
          "title": "`insertRow`",
          "line": 66
        },
        {
          "level": 3,
          "title": "`updateRow`",
          "line": 77
        },
        {
          "level": 3,
          "title": "`updateCell`",
          "line": 87
        },
        {
          "level": 3,
          "title": "`removeRow`",
          "line": 99
        },
        {
          "level": 3,
          "title": "`setRecords`",
          "line": 109
        },
        {
          "level": 3,
          "title": "`getRecords`",
          "line": 119
        },
        {
          "level": 3,
          "title": "`getSelectedRows`",
          "line": 127
        },
        {
          "level": 3,
          "title": "`selectRow`",
          "line": 135
        },
        {
          "level": 3,
          "title": "`setRowStyle`",
          "line": 146
        },
        {
          "level": 3,
          "title": "`setCellStyle`",
          "line": 157
        },
        {
          "level": 3,
          "title": "`expandRow`",
          "line": 169
        },
        {
          "level": 3,
          "title": "`collapseRow`",
          "line": 179
        },
        {
          "level": 3,
          "title": "`toggleExpand`",
          "line": 189
        },
        {
          "level": 3,
          "title": "`setChildren`",
          "line": 199
        },
        {
          "level": 3,
          "title": "`startEdit`",
          "line": 210
        },
        {
          "level": 3,
          "title": "`saveEdit`",
          "line": 220
        },
        {
          "level": 3,
          "title": "`cancelEdit`",
          "line": 230
        },
        {
          "level": 3,
          "title": "`isEditing`",
          "line": 240
        },
        {
          "level": 3,
          "title": "`getEditingKey`",
          "line": 250
        },
        {
          "level": 3,
          "title": "`setColDataSource`",
          "line": 258
        },
        {
          "level": 2,
          "title": "事件",
          "line": 269
        }
      ],
      "codeBlocks": [],
      "links": [],
      "quality": {
        "attributeCount": 12,
        "eventCount": 7,
        "methodCount": 20,
        "slotCount": 0,
        "exampleCount": 0,
        "codeBlockCount": 0,
        "missingSections": [
          "slots",
          "examples"
        ],
        "parseWarnings": [],
        "qualityStatus": "partial"
      },
      "components": [
        {
          "name": "ComplextTable",
          "description": null,
          "attributes": [
            {
              "name": "keyname",
              "type": "string",
              "required": null,
              "defaultValue": "key",
              "description": "行数据唯一标识字段名",
              "sourceRef": {
                "sourceId": "ncom-repository-docs",
                "sourceType": "official-doc",
                "path": ".framework-sources/ncom-a350b57/doc/api/components/complexttable.md",
                "url": null,
                "lineStart": 16,
                "lineEnd": 16,
                "sha256": "sha256:5d1fcb6a733e292ae1a42f288a93c25220a9cbfd0279f540a409840cb6d1f01c",
                "commit": "a350b576bbeae6c6254273037a17d2a8730fb80f"
              }
            },
            {
              "name": "data-source",
              "type": "Record<string, unknown>[]",
              "required": null,
              "defaultValue": null,
              "description": "表格数据源；可含 children（或 children-key）",
              "sourceRef": {
                "sourceId": "ncom-repository-docs",
                "sourceType": "official-doc",
                "path": ".framework-sources/ncom-a350b57/doc/api/components/complexttable.md",
                "url": null,
                "lineStart": 17,
                "lineEnd": 17,
                "sha256": "sha256:5d1fcb6a733e292ae1a42f288a93c25220a9cbfd0279f540a409840cb6d1f01c",
                "commit": "a350b576bbeae6c6254273037a17d2a8730fb80f"
              }
            },
            {
              "name": "items",
              "type": "ComplextTableColumn[]",
              "required": null,
              "defaultValue": null,
              "description": "主表列定义",
              "sourceRef": {
                "sourceId": "ncom-repository-docs",
                "sourceType": "official-doc",
                "path": ".framework-sources/ncom-a350b57/doc/api/components/complexttable.md",
                "url": null,
                "lineStart": 18,
                "lineEnd": 18,
                "sha256": "sha256:5d1fcb6a733e292ae1a42f288a93c25220a9cbfd0279f540a409840cb6d1f01c",
                "commit": "a350b576bbeae6c6254273037a17d2a8730fb80f"
              }
            },
            {
              "name": "sub-items",
              "type": "ComplextTableColumn[]",
              "required": null,
              "defaultValue": null,
              "description": "子表格列定义；配置后自动开启展开",
              "sourceRef": {
                "sourceId": "ncom-repository-docs",
                "sourceType": "official-doc",
                "path": ".framework-sources/ncom-a350b57/doc/api/components/complexttable.md",
                "url": null,
                "lineStart": 19,
                "lineEnd": 19,
                "sha256": "sha256:5d1fcb6a733e292ae1a42f288a93c25220a9cbfd0279f540a409840cb6d1f01c",
                "commit": "a350b576bbeae6c6254273037a17d2a8730fb80f"
              }
            },
            {
              "name": "children-key",
              "type": "string",
              "required": null,
              "defaultValue": "children",
              "description": "子表格数据字段名",
              "sourceRef": {
                "sourceId": "ncom-repository-docs",
                "sourceType": "official-doc",
                "path": ".framework-sources/ncom-a350b57/doc/api/components/complexttable.md",
                "url": null,
                "lineStart": 20,
                "lineEnd": 20,
                "sha256": "sha256:5d1fcb6a733e292ae1a42f288a93c25220a9cbfd0279f540a409840cb6d1f01c",
                "commit": "a350b576bbeae6c6254273037a17d2a8730fb80f"
              }
            },
            {
              "name": "expandable",
              "type": "boolean（无值属性）",
              "required": null,
              "defaultValue": null,
              "description": "开启展开列；配置 sub-items 时也会开启，无值属性",
              "sourceRef": {
                "sourceId": "ncom-repository-docs",
                "sourceType": "official-doc",
                "path": ".framework-sources/ncom-a350b57/doc/api/components/complexttable.md",
                "url": null,
                "lineStart": 21,
                "lineEnd": 21,
                "sha256": "sha256:5d1fcb6a733e292ae1a42f288a93c25220a9cbfd0279f540a409840cb6d1f01c",
                "commit": "a350b576bbeae6c6254273037a17d2a8730fb80f"
              }
            },
            {
              "name": "grid-line",
              "type": "rows | cols | both",
              "required": null,
              "defaultValue": null,
              "description": "网格线类型",
              "sourceRef": {
                "sourceId": "ncom-repository-docs",
                "sourceType": "official-doc",
                "path": ".framework-sources/ncom-a350b57/doc/api/components/complexttable.md",
                "url": null,
                "lineStart": 22,
                "lineEnd": 22,
                "sha256": "sha256:5d1fcb6a733e292ae1a42f288a93c25220a9cbfd0279f540a409840cb6d1f01c",
                "commit": "a350b576bbeae6c6254273037a17d2a8730fb80f"
              }
            },
            {
              "name": "row-alt",
              "type": "boolean（无值属性）",
              "required": null,
              "defaultValue": null,
              "description": "行颜色交替，无值属性",
              "sourceRef": {
                "sourceId": "ncom-repository-docs",
                "sourceType": "official-doc",
                "path": ".framework-sources/ncom-a350b57/doc/api/components/complexttable.md",
                "url": null,
                "lineStart": 23,
                "lineEnd": 23,
                "sha256": "sha256:5d1fcb6a733e292ae1a42f288a93c25220a9cbfd0279f540a409840cb6d1f01c",
                "commit": "a350b576bbeae6c6254273037a17d2a8730fb80f"
              }
            },
            {
              "name": "header-style",